Year,Policy_Event,General_Baseline_Tariff_%,Key_Country_Specific_Tariff,Key_Sectors,Tariff_Change_Description
2020,Routine WTO/NAFTA,2.6%,China: 7-25%,Steel/Aluminum/Auto,Standard MFN rates, Section 301 China tariffs continue
2021,COVID-19 disruptions,2.6%,China: 7-25%,Pharma/Medical,Limited additional tariffs, tariff waivers for COVID recovery
2022,Biden moderate adjustment,2.5%,China: 7-25%,Consumer goods/Tech,Some reductions for essential goods, tariff exemptions
2023,Trade tensions rise,2.44%,China: 7-25%,Tech/Agriculture,No major changes, high China tariffs remain
2024,Pre-election uncertainty,2.44%,China: 7-25%,Various,MFN baseline, trade war tariffs carried over
2025,"Reciprocal Tariff" regime,10-34%,China: 34%, EU: 20%, Canada/Mexico (autos): 25%,Steel/Aluminum/Auto/Tech,Federal order sets 10% minimum for all partners; individualized: China 34%, EU 20%, pharma exemptions, Section 232 steel 50%
